{
  "id": "flow-swimlane-1",
  "pageId": "page-2",
  "type": "flowchart",
  "position": { "x": 40, "y": 480 },
  "size": { "width": 720, "height": 420 },
  "style": {},
  "data": {
    "nodes": [
      { "id": "node-1", "type": "start", "text": "需求提出", "swimlaneId": "lane-a" },
      { "id": "node-2", "type": "process", "text": "需求评审", "swimlaneId": "lane-a" },
      { "id": "node-3", "type": "process", "text": "开发实现", "swimlaneId": "lane-b" },
      { "id": "node-4", "type": "end", "text": "发布上线", "swimlaneId": "lane-b" }
    ],
    "connectors": [
      { "id": "edge-1", "from": "node-1", "to": "node-2" },
      { "id": "edge-2", "from": "node-2", "to": "node-3" },
      { "id": "edge-3", "from": "node-3", "to": "node-4" }
    ],
    "swimlanes": [
      { "id": "lane-a", "name": "需求阶段" },
      { "id": "lane-b", "name": "开发阶段" }
    ],
    "direction": "topToBottom"
  }
}
